{
  "schema_version": "1.0",
  "template_version": "1.0.0",
  "id": "chaveiro-3x4",
  "name": "Chaveiro 3x4 — folha 216x152",
  "status": "production",
  "canvas": {
    "width_mm": 216,
    "height_mm": 152,
    "dpi": 300
  },
  "output": {
    "format": "JPEG",
    "quality": 95,
    "filename_prefix": "Chaveiro_"
  },
  "slots": [
    {
      "id": "slot_01",
      "x_mm": 6,
      "y_mm": 10,
      "width_mm": 34,
      "height_mm": 44,
      "fit": "cover",
      "allow_pan": true,
      "allow_zoom": true,
      "allow_rotate": true
    },
    {
      "id": "slot_02",
      "x_mm": 40,
      "y_mm": 10,
      "width_mm": 34,
      "height_mm": 44,
      "fit": "cover",
      "allow_pan": true,
      "allow_zoom": true,
      "allow_rotate": true
    },
    {
      "id": "slot_03",
      "x_mm": 74,
      "y_mm": 10,
      "width_mm": 34,
      "height_mm": 44,
      "fit": "cover",
      "allow_pan": true,
      "allow_zoom": true,
      "allow_rotate": true
    },
    {
      "id": "slot_04",
      "x_mm": 108,
      "y_mm": 10,
      "width_mm": 34,
      "height_mm": 44,
      "fit": "cover",
      "allow_pan": true,
      "allow_zoom": true,
      "allow_rotate": true
    },
    {
      "id": "slot_05",
      "x_mm": 142,
      "y_mm": 10,
      "width_mm": 34,
      "height_mm": 44,
      "fit": "cover",
      "allow_pan": true,
      "allow_zoom": true,
      "allow_rotate": true
    },
    {
      "id": "slot_06",
      "x_mm": 176,
      "y_mm": 10,
      "width_mm": 34,
      "height_mm": 44,
      "fit": "cover",
      "allow_pan": true,
      "allow_zoom": true,
      "allow_rotate": true
    },
    {
      "id": "slot_07",
      "x_mm": 6,
      "y_mm": 54,
      "width_mm": 34,
      "height_mm": 44,
      "fit": "cover",
      "allow_pan": true,
      "allow_zoom": true,
      "allow_rotate": true
    },
    {
      "id": "slot_08",
      "x_mm": 40,
      "y_mm": 54,
      "width_mm": 34,
      "height_mm": 44,
      "fit": "cover",
      "allow_pan": true,
      "allow_zoom": true,
      "allow_rotate": true
    },
    {
      "id": "slot_09",
      "x_mm": 74,
      "y_mm": 54,
      "width_mm": 34,
      "height_mm": 44,
      "fit": "cover",
      "allow_pan": true,
      "allow_zoom": true,
      "allow_rotate": true
    },
    {
      "id": "slot_10",
      "x_mm": 108,
      "y_mm": 54,
      "width_mm": 34,
      "height_mm": 44,
      "fit": "cover",
      "allow_pan": true,
      "allow_zoom": true,
      "allow_rotate": true
    },
    {
      "id": "slot_11",
      "x_mm": 142,
      "y_mm": 54,
      "width_mm": 34,
      "height_mm": 44,
      "fit": "cover",
      "allow_pan": true,
      "allow_zoom": true,
      "allow_rotate": true
    },
    {
      "id": "slot_12",
      "x_mm": 176,
      "y_mm": 54,
      "width_mm": 34,
      "height_mm": 44,
      "fit": "cover",
      "allow_pan": true,
      "allow_zoom": true,
      "allow_rotate": true
    },
    {
      "id": "slot_13",
      "x_mm": 6,
      "y_mm": 98,
      "width_mm": 34,
      "height_mm": 44,
      "fit": "cover",
      "allow_pan": true,
      "allow_zoom": true,
      "allow_rotate": true
    },
    {
      "id": "slot_14",
      "x_mm": 40,
      "y_mm": 98,
      "width_mm": 34,
      "height_mm": 44,
      "fit": "cover",
      "allow_pan": true,
      "allow_zoom": true,
      "allow_rotate": true
    },
    {
      "id": "slot_15",
      "x_mm": 74,
      "y_mm": 98,
      "width_mm": 34,
      "height_mm": 44,
      "fit": "cover",
      "allow_pan": true,
      "allow_zoom": true,
      "allow_rotate": true
    },
    {
      "id": "slot_16",
      "x_mm": 108,
      "y_mm": 98,
      "width_mm": 34,
      "height_mm": 44,
      "fit": "cover",
      "allow_pan": true,
      "allow_zoom": true,
      "allow_rotate": true
    },
    {
      "id": "slot_17",
      "x_mm": 142,
      "y_mm": 98,
      "width_mm": 34,
      "height_mm": 44,
      "fit": "cover",
      "allow_pan": true,
      "allow_zoom": true,
      "allow_rotate": true
    },
    {
      "id": "slot_18",
      "x_mm": 176,
      "y_mm": 98,
      "width_mm": 34,
      "height_mm": 44,
      "fit": "cover",
      "allow_pan": true,
      "allow_zoom": true,
      "allow_rotate": true
    }
  ],
  "overlay": null,
  "groups": [],
  "provenance": {
    "measured": [
      "canvas 216x152 mm (15x21 cm fotográfico paisagem)",
      "slot 34x44 mm (3x4 fotográfico)",
      "grade 6x3 = 18 fotos por folha"
    ],
    "derived": [
      "grade centralizada: 6 mm laterais e 10 mm verticais",
      "DPI de produção definido em 300 DPI"
    ],
    "pending": []
  },
  "notes": [
    "Todos os 18 slots permitem substituição individual.",
    "Ação de preenchimento em lote preenche toda a folha com a mesma foto."
  ]
}
