{
  "schema_version": "1.0",
  "template_version": "1.1.0",
  "id": "globo-neve",
  "name": "Globo de Neve",
  "status": "production",
  "canvas": {
    "width_mm": 152,
    "height_mm": 102,
    "dpi": 300
  },
  "output": {
    "format": "JPEG",
    "quality": 95,
    "filename_prefix": "Globo_"
  },
  "slots": [
    {
      "id": "foto_1",
      "x_mm": 16.7,
      "y_mm": 10.2,
      "width_mm": 50.0,
      "height_mm": 80.0,
      "fit": "cover",
      "allow_pan": true,
      "allow_zoom": true,
      "allow_rotate": true
    },
    {
      "id": "foto_2",
      "x_mm": 73.7,
      "y_mm": 10.2,
      "width_mm": 50.0,
      "height_mm": 80.0,
      "fit": "cover",
      "allow_pan": true,
      "allow_zoom": true,
      "allow_rotate": true
    }
  ],
  "overlay": null,
  "groups": [],
  "provenance": {
    "measured": [
      "canvas 152x102 mm (10x15 cm fotográfico horizontal)",
      "2 fotos de 50x80 mm (largura x altura)"
    ],
    "derived": [
      "layout assimétrico derivado de fotografia de referência: foto_1 (x=16.7, y=10.2), foto_2 (x=73.7, y=10.2), gap 7.0 mm, margem direita 28.3 mm, margem inferior 11.8 mm (IMAGE_DERIVED)",
      "DPI de produção definido em 300 DPI"
    ],
    "pending": []
  },
  "notes": [
    "Sem overlay transparente: fundo branco opaco com linhas de guia de corte sutis.",
    "Cada slot pode usar foto individual ou ser duplicado com 1 clique.",
    "Pendente confirmação vetorial numérica via arquivo CorelDRAW / gabarito oficial do laboratório."
  ]
}
